{
  "id": "boxing_minimal_tracking",
  "format": "minimal_tracking",
  "title": "Boxing minimal tracking",
  "csvFile": "minimal_tracking.csv",
  "time": {
    "column": "t",
    "unit": "s"
  },
  "position": {
    "xColumn": "x",
    "yColumn": "y"
  },
  "space": {
    "origin": {
      "x": 0,
      "y": 0
    },
    "dimensions": {
      "width": 6.1,
      "height": 6.1
    },
    "unit": "m"
  },
  "applicableSports": [
    "boxing"
  ]
}
