{
  "id": "minimal_tracking",
  "format": "minimal_tracking",
  "title": "Minimal tracking",
  "csvFile": "minimal_tracking.csv",
  "time": {
    "column": "t",
    "unit": "s"
  },
  "position": {
    "xColumn": "x",
    "yColumn": "y"
  },
  "space": {
    "origin": {
      "x": 0,
      "y": 0
    },
    "dimensions": {
      "width": 100,
      "height": 100
    },
    "unit": "m"
  },
  "applicableSports": [
    "swimming",
    "table-tennis"
  ]
}
