{
  "id": "speed_climbing_minimal_tracking",
  "format": "minimal_tracking",
  "title": "Speed climbing minimal tracking",
  "csvFile": "minimal_tracking.csv",
  "time": {
    "column": "t",
    "unit": "s"
  },
  "position": {
    "xColumn": "x",
    "yColumn": "y"
  },
  "space": {
    "origin": {
      "x": 0,
      "y": 0
    },
    "dimensions": {
      "width": 3,
      "height": 15
    },
    "unit": "m"
  },
  "applicableSports": [
    "speed-climbing"
  ]
}
